{"contract":"Escrow","previews":[{"classification":"CovenantStateTransition","consumes":["Escrow compiled locking state"],"contract":"Escrow","creates":["transaction outputs selected by the spend path"],"network":"Tn12","proof":{"payload_hint":"no proof payload","public_inputs":[],"verifier":"None"},"signers":["sig_a","sig_b"],"transition":"release","warnings":["Review `release` as a Kaspa contract spend path before signing.","This is a covenant state transition preview, not an ordinary payment preview."]}],"schema_version":"kaspascript.cli.kernel.preview.v0","target":"verified-tn12"}
